{"implementation_profile_id":"triton_ascend","onboarding_disposition":"promotion-pending","probe_definition_sha256":"870f9cbec0d8d1e47152a8ec217f4370bbfa1e00f3b96b598a3251b198d04a13","probe_id":"triton-ascend-num-warps-001","recommendations":[{"capability_id":"resource.num-warps","current_status":"unknown","evidence_refs":["results/triton-ascend-num-warps-001.json","run.json"],"rationale":"Numerically checked observed success within the probe's exact scope; v1 renderer never recommends supported.","recommended_status":"constrained","source_scope":{"block":128,"device_arch":"ascend-910b4","dtype":"fp32","target_id":"ascend910b","toolchain":"triton 3.2.0 / torch_npu 2.7.1.post4","values":[1,2,4,8]}}],"result_sha256":"15ef0afe58f991e5fe9a57bff79cc2cedcb69737fe1769fb80a5765194e28834","review_status":"proposed","run_id":"nw-20260830","schema_version":1,"unresolved_gaps":[]}
