{"implementation_profile_id":"triton_ascend","onboarding_disposition":"promotion-pending","probe_definition_sha256":"9efc2c86c27a87714eb7529a267f3c1f01b644a2000139db1ef969022f0eca34","probe_id":"triton-ascend-dot-tiles-001","recommendations":[{"capability_id":"matrix.dot.fp16-fp16-fp32.tile-coverage","current_status":"unknown","evidence_refs":["results/triton-ascend-dot-tiles-001.json","run.json"],"rationale":"Numerically checked observed success within the probe's exact scope; v1 renderer never recommends supported.","recommended_status":"constrained","source_scope":{"accumulator_dtype":"fp32","device_arch":"ascend-910b4","lhs_dtype":"fp16","rhs_dtype":"fp16","target_id":"ascend910b","tile_groups":["multiple-of-16","non-multiple-of-16","power-of-two"],"toolchain":"triton 3.2.0 / torch_npu 2.7.1.post4"}}],"result_sha256":"c0670e9be7ec0641fef877f7ee627faeade0ce14aae6c922d82a2a097858f114","review_status":"proposed","run_id":"dot-fp16-20260830","schema_version":1,"unresolved_gaps":[]}
