{"implementation_profile_id":"triton_ascend","onboarding_disposition":"promotion-pending","probe_definition_sha256":"fc4baa5a8109d89c39e33192aa7e04ffb2cacb1737b461ef5b49c15b3b20684d","probe_id":"triton-ascend-num-stages-001","recommendations":[{"capability_id":"resource.num-stages","current_status":"unknown","evidence_refs":["results/triton-ascend-num-stages-001.json","run.json"],"rationale":"Numerically checked observed success within the probe's exact scope; v1 renderer never recommends supported.","recommended_status":"constrained","source_scope":{"block":64,"device_arch":"ascend-910b4","dtype":"fp32","target_id":"ascend910b","toolchain":"triton 3.2.0 / torch_npu 2.7.1.post4","values":[1,2,3,4]}}],"result_sha256":"3c4b32f7cbeb86007057765c23d228841156b5a33eb65ae3d19b23a6b863591b","review_status":"proposed","run_id":"ns-20260830","schema_version":1,"unresolved_gaps":[]}
